[
  {
    "entry_id": "sample_balance_20260616",
    "entry_date": "2026-06-16",
    "direction": "BalanceSnapshot",
    "category": "Other",
    "amount": 18000.0,
    "currency": "AUD",
    "account": "sanitized_operating_cash",
    "counterparty": "internal_review",
    "description": "Synthetic reviewed operating cash balance for workflow smoke only.",
    "evidence_link": "sample://cashflow/balance-snapshot-2026-06-16",
    "evidence_path": "",
    "review_status": "Reviewed",
    "recurring": false,
    "notes": "Public-safe example. Replace with private reviewed evidence under data/private/cashflow."
  },
  {
    "entry_id": "sample_inflow_20260615",
    "entry_date": "2026-06-15",
    "direction": "Inflow",
    "category": "ServiceRevenue",
    "amount": 4200.0,
    "currency": "AUD",
    "account": "sanitized_operating_cash",
    "counterparty": "sample_client_a",
    "description": "Synthetic reviewed paid invoice.",
    "evidence_link": "sample://cashflow/invoice-paid-2026-06-15",
    "evidence_path": "",
    "review_status": "Reviewed",
    "recurring": false,
    "notes": "Public-safe example."
  },
  {
    "entry_id": "sample_outflow_20260614",
    "entry_date": "2026-06-14",
    "direction": "Outflow",
    "category": "Software",
    "amount": 360.0,
    "currency": "AUD",
    "account": "sanitized_operating_cash",
    "counterparty": "sample_vendor_a",
    "description": "Synthetic reviewed software subscription.",
    "evidence_link": "sample://cashflow/software-receipt-2026-06-14",
    "evidence_path": "",
    "review_status": "Reviewed",
    "recurring": true,
    "notes": "Public-safe example."
  },
  {
    "entry_id": "sample_receivable_20260616",
    "entry_date": "2026-06-16",
    "direction": "Receivable",
    "category": "SalesRevenue",
    "amount": 2500.0,
    "currency": "AUD",
    "account": "sanitized_operating_cash",
    "counterparty": "sample_client_b",
    "description": "Synthetic reviewed receivable, not counted as current cash.",
    "evidence_link": "sample://cashflow/receivable-2026-06-16",
    "evidence_path": "",
    "review_status": "Reviewed",
    "recurring": false,
    "notes": "Public-safe example."
  },
  {
    "entry_id": "sample_payable_20260616",
    "entry_date": "2026-06-16",
    "direction": "Payable",
    "category": "Compliance",
    "amount": 800.0,
    "currency": "AUD",
    "account": "sanitized_operating_cash",
    "counterparty": "sample_vendor_b",
    "description": "Synthetic reviewed payable, not counted as current cash outflow.",
    "evidence_link": "sample://cashflow/payable-2026-06-16",
    "evidence_path": "",
    "review_status": "Reviewed",
    "recurring": false,
    "notes": "Public-safe example."
  }
]
